title,service,citation,dataDownload,description,license,organization,organization-long,source,short-description,subtitle,id
"PERSIANN Precipitation Estimation -- Global","168","http://dx.doi.org/10.7289/V51V5BWQ","","The data covers from 60 degrees S to 60 degrees N and 0 degrees to 360 degrees longitude at 0.25 degree spatial resolution. The product is developed using Gridded Satellite (GridSat-B1) IR data that are derived from merging ISCCP B1 IR data, along with GPCP version 2.2.","U.S. Government Work","NOAA","National Oceanic and Atmospheric Administration, Department of Commerce","http://gis.ncdc.noaa.gov/geoportal/catalog/search/resource/details.page?id=gov.noaa.ncdc:C00854","PERSIANN Precipitation Climate Data Record (PERSIANN-CDR) is a daily quasi-global precipitation product for the period of 1982 to 2011.","NOAA Climate Data Record (Version 1 Revision 2)",a65ed98a-6370-4791-bc29-602f1185e349
"Temperature Maximum -- U.S. (Regional)","192","","","","U.S. Government Work","NOAA","National Oceanic and Atmospheric Administration, Department of Commerce","http://www.cpc.ncep.noaa.gov/products/analysis_monitoring/regional_monitoring/usa.shtml","Current, 3-Month, 6-Month, 12-Month, Year-to-Date  Regional Temperature Rank Maps","NOAA NCEI Indices",a6876287-7afb-4f8c-9788-65d2528e8a23
"USGS Land Cover (2011) -- U.S. (Alaska)","280","Homer, C.G., Dewitz, J.A., Yang, L., Jin, S., Danielson, P., Xian, G., Coulston, J., Herold, N.D., Wickham, J.D., and Megown, K., 2015, Completion of the 2011 National Land Cover Database for the conterminous United States-Representing a decade of land cover change information. Photogrammetric Engineering and Remote Sensing, v. 81, no. 5, p. 345-354 ","","As with two previous NLCD land cover products NLCD 2011 keeps the same 16-class land cover classification scheme that has been applied consistently across the United States at a spatial resolution of 30 meters. NLCD 2011 is based primarily on a decision-tree classification of circa 2011 Landsat satellite data. ","U.S. Government Work","USGS","U.S. Geological Survey","http://www.mrlc.gov/nlcd11_data.php","National Land Cover Database 2011 (NLCD 2011) is the most recent national land cover product created by the Multi-Resolution Land Characteristics (MRLC) Consortium. NLCD 2011 provides - for the first time - the capability to assess wall-to-wall, spatially explicit, national land cover changes and trends across the United States from 2001 to 2011. ","USGS National Land Cover Database",a9514e98-882c-4a6b-bb78-e91a7f83d073
"Projected Change in Winter Snowpack -- U.S. (Puget Sound)","20010","Hamlet, A.F., Elsner, M.M., Mauger, G., Lee, S-Y, Tohver, I.M. An Overview of the Columbia Basin Climate Change Scenarios Project: Approach, Methods, and Summary of Key Results. Atmosphere-Ocean (in press).","http://warm.atmos.washington.edu/2860/r7climate/hb2860_delta_method_runs/","The most sensitive basins to warming are the watersheds that are near the current snowline “mixed rain and snow”. These are middle elevation basins that receive a mixture of rain and snow in the winter, and are projected to experience significant increases in winter flows and decreases in spring and summer flows as a result of warming.\n\nMore information about this analysis is available here:\nhttps://cig.uw.edu/resources/special-reports/ps-sok/\n","","University of Washington Climate Impacts Group","","http://warm.atmos.washington.edu/2860/","Maps  indicate  current  and  future  watershed  classifications,  based  on  the  proportion   of   winter   precipitation   stored   in   peak   annual   snowpack.\n","PNW Hydroclimate Scenarios Project (2860)",ac7b110d-97e1-48a2-ab96-cd1aa3e8b978
"Social Vulnerability Index (2006-2010) -- U.S. (Georgia) ","296","","https://coast.noaa.gov/htdata/SocioEconomic/SoVI2010/SoVI_2010_GA.zip","SoVI® is a valuable tool for policy makers and practitioners. It graphically illustrates the geographic variation in social vulnerability. It shows where there is uneven capacity for preparedness and response and where resources might be used most effectively to reduce the pre-existing vulnerability. SoVI® also is useful as an indicator in determining the differential recovery from disasters.The index synthesizes 27 socioeconomic variables, which the research literature suggests contribute to reduction in a community’s ability to prepare for, respond to, and recover from hazards. SoVI® data sources include primarily those from the United States Census Bureau.The data are compiled and processed by the Hazards and Vulnerability Research Institute at the University of South Carolina. The data are standardized and placed into a principal components analysis to reduce the initial set of variables into a smaller set of statistically optimized components. Adjustments are made to the components’ cardinality (positive (+) or negative (-)) to insure that positive component loadings are associated with increased vulnerability, and negative component loadings are associated with decreased vulnerability. Once the cardinalities of the components are determined, the components are added together to determine the numerical social vulnerability score for each county.SoVI® 2006-10 marks a change in the formulation of the SoVI® metric from earlier versions. New directions in the theory and practice of vulnerability science emphasize the constraints of family structure, language barriers, vehicle availability, medical disabilities, and healthcare access in the preparation for and response to disasters, thus necessitating the inclusion of such factors in SoVI®. Extensive testing of earlier conceptualizations of SoVI®, in addition to the introduction of the U.S. Census Bureau’s five-year American Community Survey (ACS) estimates, warrants changes to the SoVI® recipe, resulting in a more robust metric. These changes, pioneered with the ACS-based SoVI® 2005-09 carry over to SoVI® 2006-10, which combines the best data available from both the 2010 U.S. Decennial Census and five-year estimates from the 2006-2010 ACS. ","U.S. Government Work","NOAA","National Oceanic and Atmospheric Administration, Department of Commerce","https://coast.noaa.gov/dataregistry/search/dataset/info/sovi","The Social Vulnerability Index (SoVI®) 2006-10 measures the social vulnerability of U.S. counties to environmental hazards. The index is a comparative metric that facilitates the examination of the differences in social vulnerability among counties. ","Social Vulnerability to Environmental Hazards ",ae52c0c9-060f-4fac-9e2d-9eefe6afec08
"Social Vulnerability Index (2006-2010) -- U.S. (Delaware) ","294","","https://coast.noaa.gov/htdata/SocioEconomic/SoVI2010/SoVI_2010_DE.zip","SoVI® is a valuable tool for policy makers and practitioners. It graphically illustrates the geographic variation in social vulnerability. It shows where there is uneven capacity for preparedness and response and where resources might be used most effectively to reduce the pre-existing vulnerability. SoVI® also is useful as an indicator in determining the differential recovery from disasters.The index synthesizes 27 socioeconomic variables, which the research literature suggests contribute to reduction in a community’s ability to prepare for, respond to, and recover from hazards. SoVI® data sources include primarily those from the United States Census Bureau.The data are compiled and processed by the Hazards and Vulnerability Research Institute at the University of South Carolina. The data are standardized and placed into a principal components analysis to reduce the initial set of variables into a smaller set of statistically optimized components. Adjustments are made to the components’ cardinality (positive (+) or negative (-)) to insure that positive component loadings are associated with increased vulnerability, and negative component loadings are associated with decreased vulnerability. Once the cardinalities of the components are determined, the components are added together to determine the numerical social vulnerability score for each county.SoVI® 2006-10 marks a change in the formulation of the SoVI® metric from earlier versions. New directions in the theory and practice of vulnerability science emphasize the constraints of family structure, language barriers, vehicle availability, medical disabilities, and healthcare access in the preparation for and response to disasters, thus necessitating the inclusion of such factors in SoVI®. Extensive testing of earlier conceptualizations of SoVI®, in addition to the introduction of the U.S. Census Bureau’s five-year American Community Survey (ACS) estimates, warrants changes to the SoVI® recipe, resulting in a more robust metric. These changes, pioneered with the ACS-based SoVI® 2005-09 carry over to SoVI® 2006-10, which combines the best data available from both the 2010 U.S. Decennial Census and five-year estimates from the 2006-2010 ACS. ","U.S. Government Work","NOAA","National Oceanic and Atmospheric Administration, Department of Commerce","https://coast.noaa.gov/dataregistry/search/dataset/info/sovi","The Social Vulnerability Index (SoVI®) 2006-10 measures the social vulnerability of U.S. counties to environmental hazards. The index is a comparative metric that facilitates the examination of the differences in social vulnerability among counties. ","Social Vulnerability to Environmental Hazards ",afc90657-7d7b-42dc-a31e-a0f7a8ce8d80
"USGS Land Cover (1992) -- U.S. ","330","Vogelmann, J.E., S.M. Howard, L. Yang, C. R. Larson, B. K. Wylie, and J. N. Van Driel, 2001. Completion of the 1990's National Land Cover Data Set for the conterminous United States, Photogrammetric Engineering and Remote Sensing 67:650-662.","","NLCD92 is based primarily on the unsupervised classification of Landsat Thematic Mapper (TM) circa 1990's satellite data. Other ancillary data sources used to generate these data included topography, census, and agricultural statistics, soil characteristics, and other types of land cover and wetland maps. NLCD1992 is the only NLCD dataset that can be downloaded by state and by user defined area from the MRLC Consortium Viewer. NOTE: NLCD 1992 is not recommended for direct comparisons with any subsequent NLCD data products (i.e. NLCD 2001, NLCD 2006, NLCD 2011). The typical result of direct comparison will result in a change map showing differences between legends and mapping methods rather than real changes on the ground.","U.S. Government Work","USGS","U.S. Geological Survey","http://www.mrlc.gov/nlcd01_data.php","National Land Cover Dataset 1992 (NLCD1992) is a 21-class land cover classification scheme that has been applied consistently across the lower 48 United States at a spatial resolution of 30 meters.","USGS National Land Cover Database ",b0fb9eb9-0b72-49bc-b0c8-9a27947e1fc4
"USGS Land Cover - Impervious Surface (2001) -- U.S. (Alaska)","322","Homer, C., Dewitz, J., Fry, J., Coan, M., Hossain, N., Larson, C., Herold, N., McKerrow, A., VanDriel, J.N., and Wickham, J. 2007. Completion of the 2001 National Land Cover Database for the Conterminous United States. Photogrammetric Engineering and Remote Sensing, Vol. 73, No. 4, pp 337-341. ","","NLCD 2001 is based primarily on a decision-tree classification of circa 2001 Landsat satellite data. NLCD 2001 improves on NLCD92 in that it is comprised of three different elements: land cover, percent developed impervious surface and percent tree canopy density. NLCD 2001 also uses improved classification algorithms, which have resulted in data with more precise rendering of spatial boundaries between the land cover classes.","U.S. Government Work","USGS","U.S. Geological Survey","http://www.mrlc.gov/nlcd01_data.php","National Land Cover Database 2001 (NLCD 2001) is a 16-class (additional four classes in Alaska only) land cover classification scheme that has been applied consistently across all 50 United States and Puerto Rico at a spatial resolution of 30 meters.","USGS National Land Cover Database",b7319a3e-5c8c-46fe-9a8f-5afe41b3d31b
"Social Vulnerability Index (2006-2010) -- U.S. (Louisiana) ","301","","https://coast.noaa.gov/htdata/SocioEconomic/SoVI2010/SoVI_2010_LA.zip","SoVI® is a valuable tool for policy makers and practitioners. It graphically illustrates the geographic variation in social vulnerability. It shows where there is uneven capacity for preparedness and response and where resources might be used most effectively to reduce the pre-existing vulnerability. SoVI® also is useful as an indicator in determining the differential recovery from disasters.The index synthesizes 27 socioeconomic variables, which the research literature suggests contribute to reduction in a community’s ability to prepare for, respond to, and recover from hazards. SoVI® data sources include primarily those from the United States Census Bureau.The data are compiled and processed by the Hazards and Vulnerability Research Institute at the University of South Carolina. The data are standardized and placed into a principal components analysis to reduce the initial set of variables into a smaller set of statistically optimized components. Adjustments are made to the components’ cardinality (positive (+) or negative (-)) to insure that positive component loadings are associated with increased vulnerability, and negative component loadings are associated with decreased vulnerability. Once the cardinalities of the components are determined, the components are added together to determine the numerical social vulnerability score for each county.SoVI® 2006-10 marks a change in the formulation of the SoVI® metric from earlier versions. New directions in the theory and practice of vulnerability science emphasize the constraints of family structure, language barriers, vehicle availability, medical disabilities, and healthcare access in the preparation for and response to disasters, thus necessitating the inclusion of such factors in SoVI®. Extensive testing of earlier conceptualizations of SoVI®, in addition to the introduction of the U.S. Census Bureau’s five-year American Community Survey (ACS) estimates, warrants changes to the SoVI® recipe, resulting in a more robust metric. These changes, pioneered with the ACS-based SoVI® 2005-09 carry over to SoVI® 2006-10, which combines the best data available from both the 2010 U.S. Decennial Census and five-year estimates from the 2006-2010 ACS. ","U.S. Government Work","NOAA","National Oceanic and Atmospheric Administration, Department of Commerce","https://coast.noaa.gov/dataregistry/search/dataset/info/sovi","The Social Vulnerability Index (SoVI®) 2006-10 measures the social vulnerability of U.S. counties to environmental hazards. The index is a comparative metric that facilitates the examination of the differences in social vulnerability among counties. ","Social Vulnerability to Environmental Hazards ",bd3c2ea6-085c-4722-9444-31bc3244ddb0
"Dams -- U.S. ","266","","","","U.S. Government Work","DOT","Department of Transportation","http://www.bts.gov/programs/geographic_information_services/","This map layer portrays major dams of the United States, including Puerto Rico and the U.S. Virgin Islands (NTAD 2015). The map layer was created by extracting dams 50 feet or more in height, or with a normal storage capacity of 5,000 acre-feet or more, or with a maximum storage capacity of 25,000 acre-feet or more, from the 79,777 dams in the U.S. Army Corps of Engineers National Inventory of Dams. This is a replacement for the April 1994 map layer.","USACE Major Dams",c188cfb1-9156-41f1-a163-b05354ca9138
"Palmer Hydrological Drought Index -- U.S.","191","Palmer, W.C., 1965: Meteorological drought. Research Paper No. 45. U.S. Weather Bureau. [NOAA Library and Information Services Division, Washington, D.C. 20852]","","","U.S. Government Work","NOAA","National Oceanic and Atmospheric Administration, Department of Commerce","http://www.ncdc.noaa.gov/temp-and-precip/drought/historical-palmers/","Palmer Hydrological Drought Index measures hydrological impacts of drought (e.g., reservoir levels, groundwater levels, etc.) which take longer to develop and longer to recover from. This long-term drought index was developed to quantify these hydrological effects, and it responds more slowly to changing conditions than the PDSI.","NOAA NCEI Indices",c2d68582-09a8-4751-a6a1-431961599025
"Social Vulnerability Index (2006-2010) -- U.S. (New Jersey) ","310","","https://coast.noaa.gov/htdata/SocioEconomic/SoVI2010/SoVI_2010_NJ.zip","SoVI® is a valuable tool for policy makers and practitioners. It graphically illustrates the geographic variation in social vulnerability. It shows where there is uneven capacity for preparedness and response and where resources might be used most effectively to reduce the pre-existing vulnerability. SoVI® also is useful as an indicator in determining the differential recovery from disasters.The index synthesizes 27 socioeconomic variables, which the research literature suggests contribute to reduction in a community’s ability to prepare for, respond to, and recover from hazards. SoVI® data sources include primarily those from the United States Census Bureau.The data are compiled and processed by the Hazards and Vulnerability Research Institute at the University of South Carolina. The data are standardized and placed into a principal components analysis to reduce the initial set of variables into a smaller set of statistically optimized components. Adjustments are made to the components’ cardinality (positive (+) or negative (-)) to insure that positive component loadings are associated with increased vulnerability, and negative component loadings are associated with decreased vulnerability. Once the cardinalities of the components are determined, the components are added together to determine the numerical social vulnerability score for each county.SoVI® 2006-10 marks a change in the formulation of the SoVI® metric from earlier versions. New directions in the theory and practice of vulnerability science emphasize the constraints of family structure, language barriers, vehicle availability, medical disabilities, and healthcare access in the preparation for and response to disasters, thus necessitating the inclusion of such factors in SoVI®. Extensive testing of earlier conceptualizations of SoVI®, in addition to the introduction of the U.S. Census Bureau’s five-year American Community Survey (ACS) estimates, warrants changes to the SoVI® recipe, resulting in a more robust metric. These changes, pioneered with the ACS-based SoVI® 2005-09 carry over to SoVI® 2006-10, which combines the best data available from both the 2010 U.S. Decennial Census and five-year estimates from the 2006-2010 ACS. ","U.S. Government Work","NOAA","National Oceanic and Atmospheric Administration, Department of Commerce","https://coast.noaa.gov/dataregistry/search/dataset/info/sovi","The Social Vulnerability Index (SoVI®) 2006-10 measures the social vulnerability of U.S. counties to environmental hazards. The index is a comparative metric that facilitates the examination of the differences in social vulnerability among counties. ","Social Vulnerability to Environmental Hazards ",c3613373-cc3f-4b28-a7b1-81c4ce98665e
"Social Vulnerability Index (2006-2010) -- U.S. (Virginia) ","318","","https://coast.noaa.gov/htdata/SocioEconomic/SoVI2010/SoVI_2010_VA.zip","SoVI® is a valuable tool for policy makers and practitioners. It graphically illustrates the geographic variation in social vulnerability. It shows where there is uneven capacity for preparedness and response and where resources might be used most effectively to reduce the pre-existing vulnerability. SoVI® also is useful as an indicator in determining the differential recovery from disasters.The index synthesizes 27 socioeconomic variables, which the research literature suggests contribute to reduction in a community’s ability to prepare for, respond to, and recover from hazards. SoVI® data sources include primarily those from the United States Census Bureau.The data are compiled and processed by the Hazards and Vulnerability Research Institute at the University of South Carolina. The data are standardized and placed into a principal components analysis to reduce the initial set of variables into a smaller set of statistically optimized components. Adjustments are made to the components’ cardinality (positive (+) or negative (-)) to insure that positive component loadings are associated with increased vulnerability, and negative component loadings are associated with decreased vulnerability. Once the cardinalities of the components are determined, the components are added together to determine the numerical social vulnerability score for each county.SoVI® 2006-10 marks a change in the formulation of the SoVI® metric from earlier versions. New directions in the theory and practice of vulnerability science emphasize the constraints of family structure, language barriers, vehicle availability, medical disabilities, and healthcare access in the preparation for and response to disasters, thus necessitating the inclusion of such factors in SoVI®. Extensive testing of earlier conceptualizations of SoVI®, in addition to the introduction of the U.S. Census Bureau’s five-year American Community Survey (ACS) estimates, warrants changes to the SoVI® recipe, resulting in a more robust metric. These changes, pioneered with the ACS-based SoVI® 2005-09 carry over to SoVI® 2006-10, which combines the best data available from both the 2010 U.S. Decennial Census and five-year estimates from the 2006-2010 ACS. ","U.S. Government Work","NOAA","National Oceanic and Atmospheric Administration, Department of Commerce","https://coast.noaa.gov/dataregistry/search/dataset/info/sovi","The Social Vulnerability Index (SoVI®) 2006-10 measures the social vulnerability of U.S. counties to environmental hazards. The index is a comparative metric that facilitates the examination of the differences in social vulnerability among counties. ","Social Vulnerability to Environmental Hazards ",c507e111-33cf-48d2-bbaa-ab00fac98f73
"Monthly Outgoing Longwave Radiation (OLR) -- Global","161","","","The data set was derived using a multispectral HIRS OLR algorithm on the HIRS level 1b dataset from the TIROS-N to NOAA-19 series satellites with inter-satellite and radiance calibration adjustments employing an empirical diurnal model for the monthly mean derivation. The data file format is netCDF-4 with CF metadata, and it is accompanied by algorithm documentation, data flow diagram and source code for the NOAA CDR Program.","U.S. Government Work","NOAA","National Oceanic and Atmospheric Administration, Department of Commerce","http://www.ncdc.noaa.gov/thredds/catalog.html?dataset=olr","This Climate Data Record (CDR) of monthly mean High Resolution Infrared Radiation Sounder (HIRS) Outgoing Longwave Radiation (OLR) flux at the top of the atmosphere in all sky conditions is on a 2.5 degree x 2.5 degree grid with global coverage from January 1979 to the present and continuing monthly. Grid dimensions are 144 x 72, with 10,368 total grids over the globe. ","NOAA Climate Data Record (CDR, Version 2.2-2)",c53af417-294d-47e8-9ca0-bd6d0c4ac80c
"Palmer Hydrological Drought Index -- U.S. (Divisional)","198","Palmer, W.C., 1965: Meteorological drought. Research Paper No. 45. U.S. Weather Bureau. [NOAA Library and Information Services Division, Washington, D.C. 20852]","","","U.S. Government Work","NOAA","National Oceanic and Atmospheric Administration, Department of Commerce","http://www.ncdc.noaa.gov/temp-and-precip/drought/historical-palmers/","Palmer Hydrological Drought Index measures hydrological impacts of drought (e.g., reservoir levels, groundwater levels, etc.) which take longer to develop and longer to recover from. This long-term drought index was developed to quantify these hydrological effects, and it responds more slowly to changing conditions than the PDSI.","NOAA NCEI Indices",c7ad5f60-83ec-4e9b-a58e-761823b10770
"Cooling Degree Days - U.S. (Divisional)","199","","","Temperature data, however, are not readily available on a daily basis for climate divisions. Therefore, equations which relate the historical temperature of State climate divisions to nearby weather stations (which have temperature data accessible daily) are used to estimate climate division temperatures. ","U.S. Government Work","NOAA","National Oceanic and Atmospheric Administration, Department of Commerce","http://www7.ncdc.noaa.gov/CDO/CDODivisionalSelect.jsp","Degree days are estimated for State climate divisions and then population weighted to more accurately reflect temperature-related energy consumption at the State, regional, and national levels","NOAA NCEI Indices",c98806b9-2db0-4a94-90f1-71ef61d71656
"Projected Annual Temperature and Precipitation -- U.S. (Sonoma County)","20003","L.E. Flint and A.L. Flint, 2014, California Basin Characterization Model: A Dataset of Historical and Future Hydrologic Response to Climate Change, U.S. Geological Survey Data Release, doi:10.5066/F76T0JPB","http://data1.pointblue.org:8080/thredds/catalog.html","California Climate Commons Metadata Record 1: http://climate.calcommons.org/sites/default/files/metadata/California_Basin_Characterization_Model_BCM_downscaled_climate_and_hydrology.xml ","U.S. Government Work","USGS","","http://climate.calcommons.org/article/featured-dataset-california-basin-characterization-model","Data are annual time series of historical precipitation and summer air temperature and 6 projected future climates.","USGS California Basin Characterization Model",c9a1753c-9bc5-4024-b4bd-dff9ec9044c1
